[
  {"schema_version":"1.0.0","plan_id":"pln_0000000000000001","decision_id":"dec_0000000000000001","request_id":"req_0000000000000001","created_at":"2026-01-01T00:00:01Z","kind":"single","steps":[{"step_id":"step_00000001","protocol_id":"example-deploy","bundle_id":"bnd_0000000000000001","depends_on":[],"mutation_scope":["fixture/service-a"],"checkpoint_policy":"rollback-and-stop","receipt_required":true,"model_class":"balanced","var_ids":["example-state"],"tool_allowlist":["read","exec"],"guardrails":["Operate only on the fixture resource."]}],"completion_policy":{"mode":"all-steps-terminal","aggregate_receipt_required":false}},
  {"schema_version":"1.0.0","plan_id":"pln_0000000000000002","decision_id":"dec_0000000000000002","request_id":"req_0000000000000002","created_at":"2026-01-01T00:00:02Z","kind":"composite","steps":[{"step_id":"step_00000002","protocol_id":"example-config","bundle_id":"bnd_0000000000000002","depends_on":[],"mutation_scope":["fixture/shared-config"],"checkpoint_policy":"commit-and-stop","receipt_required":true,"model_class":"fast","var_ids":["example-config-state"],"tool_allowlist":["read","edit"],"guardrails":["Validate the fixture configuration."]},{"step_id":"step_00000003","protocol_id":"example-deploy","bundle_id":"bnd_0000000000000003","depends_on":["step_00000002"],"mutation_scope":["fixture/shared-config"],"checkpoint_policy":"rollback-and-stop","receipt_required":true,"model_class":"balanced","var_ids":["example-deploy-state"],"tool_allowlist":["read","exec"],"guardrails":["Use the validated fixture configuration."]}],"serialization_groups":[{"resource":"fixture/shared-config","step_ids":["step_00000002","step_00000003"]}],"completion_policy":{"mode":"all-steps-terminal","aggregate_receipt_required":true}}
]
